"0","Produce if prove but strong","Food","0","208.85","Because account final discover success reach radio still car throughout commercial"
"1","Threat rise suggest wish","Electronics","0","8.04","Reduce everybody especially our impact baby against despite money adult for yard as"
"2","Follow particular author machine network","Food","0","288.73","Down single southern name nature order story argue page important toward"
"3","Agency above radio","Electronics","0","401.63","Statement number everyone peace can expect realize air school yourself near receive hear"
"4","Protect huge","Food","0","201.12","Sometimes art director herself true common share meeting half wait"
"5","Down head","Electronics","0","250.94","Between myself better lose guy prepare civil moment trial deal material interview"
"6","Article level yet would","Food","0","36.16","Off tough difference impact management practice month audience just really"
"7","Couple go up town","Home Goods","0","352.88","Fire space usually detail image vote account themselves"
"8","International order herself new and","Cosmetics","0","404.97","Court realize rest oil official station those"
"9","Only hope about movie","Home Goods","0","241.91","We that about executive computer fear"
"10","Next believe rather","Electronics","0","327.29","The station time member color southern contain near nature culture which"
"11","Cultural at care share","Cosmetics","0","217.35","Money student near then understand however effect from program"
"12","Seat strategy","Food","0","34.16","Happen what record right conference tonight fight study miss minute"
"13","Court its property trade","Electronics","0","148.74","Upon TV police officer security reason every focus close"
"14","Garden free back practice","Home Goods","0","366.45","Agent record structure one prepare organization certainly blue side speak TV"
"15","Network language suffer land lot","Home Goods","0","439.93","When institution agency which impact parent story six degree cultural rule including"
"16","Share man full especially street","Food","0","489.13","Side air position inside official hold"
"17","Reflect onto prepare those admit","Food","0","418.37","If guess owner on buy skin various set four free"
"18","Peace know","Electronics","0","97.12","Red about perhaps green score science door bar save lose bank"
"19","For always follow boy would","Food","0","467.48","Give own note along play crime produce nature sea mind wonder accept measure"
"20","Avoid population","Food","0","253.70","Similar identify usually site while strategy say"
"21","Control suffer letter at","Food","0","416.03","His performance watch sign than on bar occur surface keep role"
"22","By it","Home Goods","0","62.47","Market voice art by will leader management music others administration unit"
"23","Body media discover easy","Cosmetics","0","58.85","Traditional show party wall half firm fish"
"24","System rate myself big capital","Home Goods","0","422.61","Medical understand political girl thought analysis commercial"
"25","Girl sure fund","Home Goods","0","299.52","Position fish admit price live family smile quite crime"
"26","Suffer should","Food","0","4.12","Road east participant nice home pretty history benefit team suggest"
"27","Collection talk officer","Food","0","211.49","Use still successful south risk tough floor try indeed send girl"
"28","Huge allow example model","Home Goods","0","155.41","Back offer subject particular bit economic fast fine rock information as receive"
"29","Explain never audience","Home Goods","0","422.19","Data experience as term develop at man candidate"
"30","The sometimes interesting him","Home Goods","0","448.99","Career popular account shake cultural state itself several president yard mission"
"31","Page town","Food","0","361.24","Economic specific apply staff from race street perform drop recent"
"32","Family along","Electronics","0","223.81","Individual reach four brother other tree away help likely painting way successful why"
"33","Receive significant energy reduce","Home Goods","0","87.10","Lay plan face clearly than suffer point"
"34","Hit doctor both","Electronics","0","99.20","Health notice bit set special ago impact environmental what sign memory name"
"35","Debate say","Cosmetics","0","500.44","Sort maybe quite image bed pressure"
"36","Baby figure home officer son","Food","0","210.12","Street six price sort manager strong company attention natural next"
"37","Just control local even environmental","Food","0","494.08","President night member herself partner better turn factor detail thousand opportunity court material person"
"38","Environment edge name","Electronics","0","130.73","Perform something production shake main agreement former phone lose try consumer all"
"39","Represent development perhaps successful","Electronics","0","358.51","Suddenly drop use source member must"
"40","Reduce his science good major","Cosmetics","0","18.63","Smile budget middle camera program one region produce myself"
"41","Weight former","Home Goods","0","70.83","Teacher member simple model off official authority when group security some after stuff"
"42","Might couple occur to","Food","0","469.43","Huge low rule item never eight court wide child"
"43","Why main wall grow","Food","0","464.32","Seem yard foreign though during admit card author interview"
"44","Bag offer employee","Home Goods","0","432.23","Purpose seat water nothing successful change than and again dinner"
"45","Remember they garden","Home Goods","0","222.70","Force order discover exactly sense threat about staff style win"
"46","Case well though seat","Cosmetics","0","78.49","Hotel leader step federal board data newspaper I wide campaign might"
"47","Hear party sure","Food","0","133.43","Admit alone option ready trouble western car break early sort can election morning"
"48","School couple finally turn","Home Goods","0","332.99","Animal pass find man fast however industry buy score"
"49","Source professor behavior environmental","Food","0","304.62","Police important add head learn expect"
"50","Leg many effort station","Cosmetics","0","468.61","Painting send team number wife as from south detail include"
"51","From run manager cell","Cosmetics","0","326.66","Effect culture glass executive in movement may poor do class door believe expect"
"52","Although beyond important","Home Goods","0","399.13","Huge away movement would again low"
"53","Contain investment expert","Food","0","223.62","Case attack break keep travel least watch"
"54","Foot dog education little surface","Food","0","52.90","Direction after listen prevent point glass picture run"
"55","Since population develop amount","Home Goods","0","47.20","Fire perhaps join result project possible line attention take evidence any"
"56","Foreign indeed within example research","Home Goods","0","423.72","Nor your education century toward large"
"57","Many actually business community any","Electronics","0","210.04","Her cultural may explain move parent skin past"
"58","Special cell save bank","Cosmetics","0","471.78","Ok something not better speech least official goal improve analysis medical"
"59","Animal change fund agreement relate","Electronics","0","138.18","Change brother spend ahead action why bad"
"60","Job them finish","Home Goods","0","52.78","Deep network control sound occur thousand fall challenge whether past couple degree"
"61","High poor energy","Electronics","0","17.19","Thing radio ago such begin body relationship"
"62","Play have whole building newspaper","Electronics","0","76.70","Lead even relationship article other image free green name list lay"
"63","Outside however certainly detail","Electronics","0","157.01","Investment necessary billion garden animal eye"
"64","Country different prepare","Cosmetics","0","395.09","Catch huge research item life song"
"65","Minute question few","Electronics","0","130.30","Would natural laugh all art poor"
"66","Behind may matter hope","Home Goods","0","425.48","Whatever across career hotel environment prepare tax money"
"67","The particular history","Cosmetics","0","475.75","Public hear fall bit nation reach"
"68","Certain wide give front manager","Electronics","0","398.09","Old trouble individual recognize summer air hundred clear"
"69","Moment soldier around oil college","Food","0","156.37","Nature brother on agency part weight conference service social protect style others response"
"70","Floor may water group","Home Goods","0","308.47","Whose daughter purpose allow half indicate present possible single successful would"
"71","Candidate loss there","Food","0","154.98","Government company already discussion service technology research from table lay white sign bed"
"72","Attack memory staff","Home Goods","0","200.98","Me bar so provide old clearly administration style"
"73","Factor describe theory","Cosmetics","0","305.22","Travel include that real share computer politics nothing military fall"
"74","Hospital lead will","Electronics","0","132.98","Sea PM us fill analysis hope safe picture"
"75","Could positive organization","Electronics","0","179.29","Enjoy from tonight up popular or benefit represent"
"76","Attorney off human eat guess","Cosmetics","0","41.78","Risk my others order director and support that ahead suffer process radio"
"77","Project boy some","Cosmetics","0","74.84","Development always simply shake special current each certainly"
"78","Region crime son","Electronics","0","40.30","Life prove movement film ground chair consider yeah"
"79","Positive fast fight","Electronics","0","483.18","Adult later manage president call former join base"
"80","Citizen size author","Food","0","348.37","Yes ground everything develop role base"
"81","Choice someone prepare","Cosmetics","0","39.76","Fight nearly play success role partner management room safe sell"
"82","Remember little argue","Home Goods","0","370.21","Whether issue story choice however tax appear"
"83","Do may bad important second","Electronics","0","498.21","Event item explain should morning none instead recently computer subject"
"84","Fall public in decade","Home Goods","0","166.95","Light cost eat after piece news Mrs investment event result along after somebody"
"85","Recent hotel population husband","Food","0","364.78","Central seven happen author civil stage possible guy mission way"
"86","And black Republican sort","Food","0","83.27","Wonder make rock could consumer help area"
"87","Agent wait like company office","Food","0","10.23","These short environmental save goal task mention author risk"
"88","Bar policy minute dinner at","Food","0","388.60","Story the partner positive single produce almost chance recent civil analysis nothing"
"89","Class class at former","Food","0","288.82","Million themselves central stage Congress soldier reason first marriage nation"
"90","May recent cover debate decade","Cosmetics","0","133.12","It only method rate wife again significant share relate end blue remember"
"91","Miss hospital","Cosmetics","0","86.31","Choice mind discussion I investment goal pretty fall"
"92","Agreement special hotel","Electronics","0","120.43","Building hand gun trip one if each matter amount prevent game thing trade"
"93","Seem put","Home Goods","0","369.81","Seem remain fact sense decade hear"
"94","South between interest program state","Electronics","0","287.48","Affect significant entire away case especially class already"
"95","Each decide source know","Cosmetics","0","380.48","Degree as billion movie eight leave for Mr forget"
"96","Suggest accept school mean","Cosmetics","0","27.01","Expert subject vote final walk range international shoulder"
"97","None many house","Home Goods","0","366.01","Audience should oil its mission claim"
"98","Human feel they against","Home Goods","0","395.23","Friend green near item serve since unit similar far couple"
"99","Lot travel that set accept","Electronics","0","124.68","Last score however reach serve assume affect guess million"
